"Although a few build quality and finesse niggles are something to be expected in a tata vehicle (even the newer ones), I'm disheartened to learn that the harrier has so many, and they are so obviously evident! and the poor steering calibration is just inexcusable since tata has never goofed up so bad in this department, before.",Build Quality,52,1.0,Build Quality,1,sttm_77
Saw the car on the road today and i found it to have good enough road presence.,Road Presence,22,0.999999899008503,Road Presence,39,sttm_42
It has very weak road presence compared to even a creta.,Road Presence,22,0.9999713740727977,Road Presence,39,sttm_42
Creta as a whole is a perfect car and it has good road presence and dynamic,Road Presence,22,0.9997527616998986,Road Presence,39,sttm_42
"Ground clearance-10/10 
 suitable for most of the bad roads and the soft suspension makes low speed rides on bad roads heaven.",Ground Clearance,22,0.9999996879818501,Road Presence,39,sttm_42
But yeah this iteration of the Creta looks terrible.,Looks,22,0.9980148204259786,Road Presence,39,sttm_42
More space and a much better road presence.,Road Presence,22,0.981686345503202,Road Presence,39,sttm_42
"Also, the 1.8 tsi (even the 1.4tsi) offers explosive performance which no car <25 lakhs can match.",Performance,22,0.9999994001708034,Road Presence,39,sttm_42
"This Kia looks very classy, especially the front end.",Looks,22,0.9214429886054987,Road Presence,39,sttm_42
"Not really impressed with the built quality, exterior look flashy but not robust.",Build Quality,22,0.896745982628984,Road Presence,39,sttm_42
"Exterior and interior is very good, road presence is very good.",Road Presence,22,0.9887561341210395,Road Presence,39,sttm_42
The road presence of the car is fabulous...,Road Presence,22,0.9884401280531244,Road Presence,39,sttm_42
Poor quality and road presence.,Road Presence,22,0.9997454299299383,Road Presence,39,sttm_42
It's a better performer than its rivals.,Performance,22,0.9227732466010111,Road Presence,39,sttm_42
It has an immense road presence.,Road Presence,22,0.9887561341210395,Road Presence,39,sttm_42
wireless charging must be offered because verna offers them and even creta does but harrier doesn't.,Wireless Charging,22,0.9999547773194042,Road Presence,39,sttm_42
It has a very imposing road presence.,Road Presence,22,0.9990746356275095,Road Presence,39,sttm_42
A strong road presence and classy interiors are certainly the best compared to jeep compass and harrier.,Road Presence,22,0.9999996678889138,Road Presence,39,sttm_42
"Wonderful in its road presence,",Road Presence,22,0.9887561341210395,Road Presence,39,sttm_42
If you are fond of big cars and want to have a good road presence then it is the best car at this price point.,Road Presence,22,0.9999509957469059,Road Presence,39,sttm_42
The glossy surfaces even in the photos look really bad.,Looks,22,0.9679424126311008,Road Presence,39,sttm_42
Road presence is good and looks are quite modern.,Road Presence,22,0.9979481591708957,Road Presence,39,sttm_42
It has a lot of road presence and looks massive and quite impressive for sure.,Road Presence,22,0.9954089760597503,Road Presence,39,sttm_42
It has some good list of features and most importantly has a tempting road presence that every Indian car buyer always wants.,Road Presence,22,0.9999998639039172,Road Presence,39,sttm_42
Its road presence is awesome and the interior is very good.,Road Presence,22,0.9887561341210395,Road Presence,39,sttm_42
"Comfort levels on uneven roads is a little jolty I don't like the way the car undulates, the suspension setting is on the harder side.",Comfort,22,0.9999860509989241,Road Presence,39,sttm_42
It has great big looking stunning design in a compact form and it has a great road presence that feels badass to be owned.,Road Presence,22,0.99992774522529,Road Presence,39,sttm_42
Excellent build quality which offers better protection to occupants.,Build Quality,22,0.9991495479646125,Road Presence,39,sttm_42
The front looks shit,Looks,22,0.7417554507834266,Road Presence,39,sttm_42
"I found it to be a great overall package, with a great engine and excellent interior space and good road presence.",Road Presence,22,0.9978892671912812,Road Presence,39,sttm_42
It's nothing compared to its rivals... interiors are great...but it lacks far behind when it comes to exterior looks...,Looks,22,0.9949114588472837,Road Presence,39,sttm_42
The front grill helps this car to get an amazing road presence.,Road Presence,22,0.9916556822473381,Road Presence,39,sttm_42
Has a very good road presence looks even better than many cars on the road and it will make you feel like the boss of the road.,Road Presence,22,0.9999988361714122,Road Presence,39,sttm_42
20 lacs for this vehicle is absurd if we go by sheer road presence.,Road Presence,22,0.9999519934940196,Road Presence,39,sttm_42
"An excellent car to drive, super stability and road presence.",Road Presence,22,0.5660688082476565,Road Presence,39,sttm_42
It is better looks and better performance.,Looks,22,0.984931633720947,Road Presence,39,sttm_42
The exteriors look horrible.,Looks,22,0.7397425073411646,Road Presence,39,sttm_42
"It has excellent road presence, good looks.",Road Presence,22,0.9979481591708957,Road Presence,39,sttm_42
"The build quality is commendable (both exterior and interior), far better than cars in the same segment.",Build Quality,22,0.9999763706693668,Road Presence,39,sttm_42
1. build quality definitely not better than Creta.,Build Quality,22,0.9963151849733973,Road Presence,39,sttm_42
The main pros of xuv is the looks and the road presence,Road Presence,22,0.9998283608919841,Road Presence,39,sttm_42
The build quality was appalling when I sat in the international model(which was btw in mint condition supposedly),Build Quality,22,0.9999379003361348,Road Presence,39,sttm_42
Real off-road car with premium looks.,Road Presence,22,0.9295836138285473,Road Presence,39,sttm_42
The road presence is amazing and dominates every other car in this segment.,Road Presence,22,0.9996398601196216,Road Presence,39,sttm_42
"Riding comfort and riding feel are good, but poor mileage, exterior, and the interior are very good, road presence is very good, service cost is expensive, bad experience in bad roads, interior plastic quality is not good.",Cost,22,0.9999999999957441,Road Presence,39,sttm_42
Good road presence and amazing built quality.,Road Presence,22,0.999419701702128,Road Presence,39,sttm_42
Striking design with a great road presence.,Road Presence,22,0.9999682287289027,Road Presence,39,sttm_42
Super drive quality and awesome road presence.,Road Presence,22,0.9995796116036165,Road Presence,39,sttm_42
"Riding comfort and riding feel are good, but poor mileage, exterior, and the interior are very good, road presence is very good, service cost is expensive, bad experience in bad roads, interior plastic quality is not good.",Comfort,22,0.9999999999957441,Road Presence,39,sttm_42
Car looks gorgeous and has road presence.,Road Presence,22,0.9978990262179027,Road Presence,39,sttm_42
Its road presence is too good and it has good safety standards.,Road Presence,22,0.9998144778001556,Road Presence,39,sttm_42
"Excellent suv fulfills all need of road presence, offroad capability and comfortable ride.",Road Presence,22,0.999999960414707,Road Presence,39,sttm_42
It has excellent road presence the vehicle sits beautifully at top speeds.,Road Presence,22,0.9999993008824256,Road Presence,39,sttm_42
Nice handling and very good road presence.,Road Presence,22,0.9990746356275095,Road Presence,39,sttm_42
Other than that it simply looks fantastic.,Looks,22,0.8457618224952743,Road Presence,39,sttm_42
Ride amazingly with comfort and with high speed.,Comfort,22,0.9779143457217694,Road Presence,39,sttm_42
It comes with sportive looks great road presence.,Road Presence,22,0.9998683849720847,Road Presence,39,sttm_42
Overall the harrier looks much smarter.,Looks,22,0.8865759450834108,Road Presence,39,sttm_42
Good looking and excellent build quality and road presence.,Road Presence,22,0.9996562600578847,Road Presence,39,sttm_42
The build quality is best in its segment.,Build Quality,22,0.7529771778512118,Road Presence,39,sttm_42
The car is superbly built and the road presence is unbeatable.,Road Presence,22,0.9999599915403821,Road Presence,39,sttm_42
The road presence is simply amazing.,Road Presence,22,0.9995150716451607,Road Presence,39,sttm_42
We've found the ride quality quite comfortable with our l&k with the one MRF.,Comfort,22,0.9995185168514015,Road Presence,39,sttm_42
"Also, the 1.8 tsi offers explosive performance which no car <25 lakhs can match.",Performance,22,0.9999912727604802,Road Presence,39,sttm_42
It looks smaller than Creta and in my honest opinion has very less road presence.,Road Presence,22,0.9999957850479155,Road Presence,39,sttm_42
Riding experience is awesome and looks also good.,Looks,22,0.9501019219906068,Road Presence,39,sttm_42
Today I saw mg hector on road. back looks very ugly,Looks,22,0.9979696990722096,Road Presence,39,sttm_42
It was awesome looking especially the exterior,Looks,22,0.4749842895609736,Road Presence,39,sttm_42
Superior off-road performance makes it all worth it!,Performance,22,0.8028938537538871,Road Presence,39,sttm_42
"And i m very happy and satisfied with the performance, comfort, and quality.",Performance,22,0.5346824131299478,Road Presence,39,sttm_42
This has good performance on Indian road there service is also too good,Performance,22,0.9983168234968413,Road Presence,39,sttm_42
Built quality is very solid and a quick peppy engine.,Build Quality,21,0.9594931409441672,Build Quality,37,sttm_42
Poor build quality.,Build Quality,21,0.8988057835766629,Build Quality,37,sttm_42
"And by heaven, the price tags of cars these days are verging on the ridiculously Stratospheric.",Cost,21,0.9999834574077201,Build Quality,37,sttm_42
"Speed, average and built quality and interiors are good.",Build Quality,21,0.8691091169647391,Build Quality,37,sttm_42
Performance is very well highly trustable in terms of engine and builds quality.,Performance,21,0.998913235652342,Build Quality,37,sttm_42
The built quality of the car is solid with a good pick up power.,Build Quality,21,0.999801467441989,Build Quality,37,sttm_42
"Never expected such a marvel from Mahindra, they have rocked the market, value for money, excellent build quality, features, and remarkable power.",Build Quality,21,0.9999999990675844,Build Quality,37,sttm_42
It’s n amazing car with great features & value for money.,Cost,21,0.9997377724620313,Build Quality,37,sttm_42
It combines premium build quality with all the latest technologies to offer a premium quality experience.,Build Quality,21,0.9994726076660017,Build Quality,37,sttm_42
Good car with a price tag but the height of the car should be a little higher.,Cost,21,0.9939987807385229,Build Quality,37,sttm_42
"This car is very smooth and powerful than other cars at this price,Mahindra XUV is the best safe car than other Mahindra car these power and torque very good, infotainment system are so nice",Infotainment System,21,0.9999997571794478,Build Quality,37,sttm_42
The Mahindra xuv500 is a very poor quality car.,Build Quality,21,0.9997440692229129,Build Quality,37,sttm_42
This car has amazing safety features and strong built quality.,Build Quality,21,0.9944352735712992,Build Quality,37,sttm_42
"Not that much costly...look and performance vise better than others, I recommend to myself..to buy this one",Cost,21,0.9998185451615303,Build Quality,37,sttm_42
The build quality is very high.,Build Quality,21,0.8988057835766629,Build Quality,37,sttm_42
The main thing I like about the car is its build quality.,Build Quality,21,0.9972462326985586,Build Quality,37,sttm_42
I have bought orcas white and it looks classy.,Looks,21,0.940588531822682,Build Quality,37,sttm_42
"The main reasons are 
 - pathetic build quality
 - below average service experience
 - poor brand image
 - long term reliability",Build Quality,21,0.9999997863767793,Build Quality,37,sttm_42
"Toyota car build-up quality is also good, very fun to drive, as u know in Toyota cars there is very low servicing & maintenance cost",Build Quality,21,0.9999999996262708,Build Quality,37,sttm_42
Fortuner is comfortable for a long journey.,Comfort,21,0.8708078970141314,Build Quality,37,sttm_42
"Over costly Fortuner, no sunroof and no automatically side mirror losers car",Cost,21,0.9880167006075663,Build Quality,37,sttm_42
"Jeep compass build quality, interior design, and quality are top-notch.",Build Quality,21,0.9999050224349617,Build Quality,37,sttm_42
"Better build quality 
 much better engines 
 proven the test of time",Build Quality,21,0.9999906154122205,Build Quality,37,sttm_42
We enthusiasts love the build quality and driving dynamics of the compass.,Build Quality,21,0.9999453052503033,Build Quality,37,sttm_42
"Price is little over for top-end model
 good ride quality 
 built quality is awesome.",Build Quality,21,0.999979758988994,Build Quality,37,sttm_42
It does look hideous and unappealing in the images.,Looks,21,0.7213141112528115,Build Quality,37,sttm_42
And yes they put it on the right price tag,Cost,21,0.98009547745377,Build Quality,37,sttm_42
Value for money awesome this is value for money superpower and build quality this is a fortune to own a Fortuner I would recommend you to buy this .it gives fair milage,Build Quality,21,0.99999999999367,Build Quality,37,sttm_42
The built quality is nice.,Build Quality,21,0.8988057835766629,Build Quality,37,sttm_42
But it looks short on height and narrow,Looks,21,0.6313463219818498,Build Quality,37,sttm_42
Build quality is also amazing......,Build Quality,21,0.8988057835766629,Build Quality,37,sttm_42
"The car looks stunning, period.",Looks,21,0.5516074971201305,Build Quality,37,sttm_42
Car quality is looking very good,Build Quality,21,0.6676759428090261,Build Quality,37,sttm_42
"If the height of the Alturas isn't enough to comfortably accommodate me, something is wrong.",Comfort,21,0.9989054217418472,Build Quality,37,sttm_42
And the sound system is the best thing in this car.,Infotainment System,21,0.5438707631374254,Build Quality,37,sttm_42
Mahindra xuv500 has a very powerful engine but built quality not perfect also other parts like breaking system is very poor.,Build Quality,21,0.9999999369606821,Build Quality,37,sttm_42
A worth buy for quality car lovers!,Build Quality,21,0.9991898343985596,Build Quality,37,sttm_42
"One of the best cars ever seen .....this can lead to cool life.nice mileage, engine power, and strong build quality.",Build Quality,21,0.9998746083757867,Build Quality,37,sttm_42
"Build quality and interior is quite good, the ride is also quite good.",Build Quality,21,0.8109695786857265,Build Quality,37,sttm_42
"Build quality, interior part quality, feature list, and space is good.",Build Quality,21,0.9997911820084487,Build Quality,37,sttm_42
Built quality is good.,Build Quality,21,0.8988057835766629,Build Quality,37,sttm_42
The Fortuner look is also very cool.,Looks,21,0.8158314209874606,Build Quality,37,sttm_42
Bose sound quality is awesome.,Infotainment System,21,0.9515368219421847,Build Quality,37,sttm_42
"The amazing car , jeep compass it is expensive",Cost,21,0.8666720250873892,Build Quality,37,sttm_42
"More space, excellent ride, and build quality, and",Build Quality,21,0.870224652381182,Build Quality,37,sttm_42
Mg hector is a premium car with a great built quality.,Build Quality,21,0.9978169788481188,Build Quality,37,sttm_42
It is a very good car Toyota Fortuner and Toyota cars are premium quality cars.,Build Quality,21,0.9999985266848451,Build Quality,37,sttm_42
Very good built quality.,Build Quality,21,0.8988057835766629,Build Quality,37,sttm_42
This car has amazing safety features and strong built quality.,Safety Features,21,0.9944352735712992,Build Quality,37,sttm_42
"Worth it, full of features, good service cost and all.",Cost,21,0.8743073539161779,Build Quality,37,sttm_42
Perfect size and the premium build quality to go along with it.,Build Quality,21,0.9980211420488533,Build Quality,37,sttm_42
You can't put a price tag on love!,Cost,21,0.6212715888495973,Build Quality,37,sttm_42
Build quality is very poor..doors are very light quality.,Build Quality,21,0.9968269024382064,Build Quality,37,sttm_42
It has great looks yes good power and space but in terms of build quality terrible if it falls in a road bump or a medium-size speed breaker the monocoque chassis has band permanently.,Build Quality,21,0.9999999999991735,Build Quality,37,sttm_42
Fabulous built quality.,Build Quality,21,0.8988057835766629,Build Quality,37,sttm_42
"In terms of value for money, I think at this current price it's a steal as it's less costly than jeep compass but has more features.",Cost,21,0.9999980420768286,Build Quality,37,sttm_42
Hector has awesome build quality.,Build Quality,21,0.9879465886142527,Build Quality,37,sttm_42
The build quality is nice.,Build Quality,21,0.8988057835766629,Build Quality,37,sttm_42
The looks the build quality is superb the infotainment system is superb.,Infotainment System,21,0.9952809831580616,Build Quality,37,sttm_42
"Powerful, stylish, feature-loaded, and tough built quality.",Build Quality,21,0.9985283484468466,Build Quality,37,sttm_42
Looks great! happy miles,Looks,21,0.5755085540906607,Build Quality,37,sttm_42
Car quality is looking very good,Looks,21,0.6676759428090261,Build Quality,37,sttm_42
So then it's not worth to take a top-end model without thesesafety features,Safety Features,21,0.9959068987678281,Build Quality,37,sttm_42
Because the built and looks of the compass are exceptionally great.,Looks,21,0.9896292720996152,Build Quality,37,sttm_42
Even it's base model has all features and safety like traction control abs ebd etc,Safety Features,15,0.9999999999856236,Safety Features,24,sttm_42
"This is the base petrol model, doesn't even have a sunroof nor front parking sensors.",Sunroof,15,0.8771530251900583,Safety Features,24,sttm_42
Safety features are good with six airbags and other features such as abs ebd.,Safety Features,15,0.9999775479637005,Safety Features,24,sttm_42
"Its gets 9 airbags, rear parking camera, rear parking sensor, park assist,abs, ebs, ebd, hill hold assist and the list just doesn't stop",Safety Features,15,0.9999999999999897,Safety Features,24,sttm_42
"The safety feature included airbags, ebd, traction control system, esp, hill hold control, hill descent control.",Safety Features,15,1.0,Safety Features,24,sttm_42
"Overall, it also comes with more comfort & safety features like 6 airbags, abs, esc, hac & vsm.",Safety Features,15,0.9999999994806019,Safety Features,24,sttm_42
The absence of rear parking sensors would be super crazy.,Safety Features,15,0.9869679336219322,Safety Features,24,sttm_42
But this variant misses out on major safety features.,Safety Features,15,0.9868559342714391,Safety Features,24,sttm_42
"In terms of basic safety features, the variant seems to be ok. It has abs, dual airbags, rear parking sensors etc.",Safety Features,15,0.9999999992291451,Safety Features,24,sttm_42
But most of the safety features are missing even in the highest variants of petrol 1.5 ivt.,Safety Features,15,0.9987614515067584,Safety Features,24,sttm_42
It is a very safe car with solid chassis and 7 airbag like features.,Safety Features,15,0.9900482285381774,Safety Features,24,sttm_42
The traction control is tremendous.,Safety Features,15,0.9953449378100551,Safety Features,24,sttm_42
"The model comes fully loaded with features like 6 airbags, esp, abs, traction control, esc and isofix anchor points.",Safety Features,15,0.9999999999999916,Safety Features,24,sttm_42
1.the car comes with fewer features even I base model there is no music system.,Infotainment System,15,0.9989605651677421,Safety Features,24,sttm_42
Needs blind-spot monitoring and adaptive cruise control,Safety Features,15,0.9993885291774233,Safety Features,24,sttm_42
No other SUV has this many safety features in the base model.,Safety Features,15,0.9996912210807202,Safety Features,24,sttm_42
It has an awesome voice control and it is also full safety features with all-around airbags.,Safety Features,15,0.9998629827939374,Safety Features,24,sttm_42
"And it comes with the latest safety features like tcs, esp which is amazing. as well as it is internet-connected car",Safety Features,15,0.9999985638812877,Safety Features,24,sttm_42
Nice car and good safety features and good braking system and nice alloys and many more,Safety Features,15,0.9983176022299349,Safety Features,24,sttm_42
But the buttons are very nice and tactile.,Looks,15,0.8499634920084524,Safety Features,24,sttm_42
Traction control is another good addition.,Safety Features,15,0.999544711837576,Safety Features,24,sttm_42
"The security systemin this car is applaudable seat belt, airbag, rearview camera system ( parking camera)",Safety Features,15,0.9999994317154324,Safety Features,24,sttm_42
"There are lots of good features like cruise control, abs with ebd andstart/stop button.",Safety Features,15,0.9999999999066378,Safety Features,24,sttm_42
"Also, front parking sensors and a front-facing camera would have been ideal for off-roading.",Safety Features,15,0.9978782644271363,Safety Features,24,sttm_42
"regarding safety, it is best in the SUV segment as it loaded with 6 airbags, esp, traction control, ebd.",Safety Features,15,0.9999999999767967,Safety Features,24,sttm_42
"The safety features, hill assist, everything is great!",Safety Features,15,0.9993138191843591,Safety Features,24,sttm_42
I don't understand why Kia not offering safety features in this variant like 6 airbags and other features,Safety Features,15,0.9999670833937155,Safety Features,24,sttm_42
The diesel engine is providing extreme performance to the car like a beast.,Performance,17,0.9991422624372174,Performance,23,sttm_42
And boot space is extra large.,Boot Space,17,0.9807927528014048,Performance,23,sttm_42
Hated it to the guts due to the cvt performance.,Performance,17,0.9977650959879514,Performance,23,sttm_42
Comfort and insulation are very bad,Comfort,17,0.8403792268086692,Performance,23,sttm_42
"The same car now costs roughly 2.5x what it did then, which is atrocious.",Cost,17,0.7070508383273257,Performance,23,sttm_42
Ground clearance is good and leg rooms is more than enough for tall people also.,Ground Clearance,17,0.9983605027633649,Performance,23,sttm_42
Great leg space at the back and with this a complete family car to enjoy your vacation if you are on a long drive.,Family Car,17,0.9997582688012405,Performance,23,sttm_42
"But rear-seat little short, and boot space is little, please increase boot space.",Boot Space,17,0.9975200830915335,Performance,23,sttm_42
"Larger boot space, more comfort & bigger size.",Boot Space,17,0.9999761339496962,Performance,23,sttm_42
"It has smooth brakes, comfortable seats, appropriate leg space, sufficient boot space, and enough ground clearance.",Boot Space,17,0.9999999472598522,Performance,23,sttm_42
It has large wheels and decent boot space.,Boot Space,17,0.9747778362748067,Performance,23,sttm_42
But they have to improve a little bit of transmission and engine performance.,Performance,17,0.9920519899423832,Performance,23,sttm_42
The Fortuner is a very good SUV car for Indian roads because of its high ground clearance and very powerful engine.,Ground Clearance,17,0.9934146391030727,Performance,23,sttm_42
Large boot space is available.,Boot Space,17,0.9151412773583623,Performance,23,sttm_42
Great engine and great experience like it too much insane performance.,Performance,17,0.7468121737492774,Performance,23,sttm_42
"Larger boot space, more comfort & bigger size.",Comfort,17,0.9999761339496962,Performance,23,sttm_42
", boot space is good, ground clearance is good, it will help for bumpy roads, unethical speed breakers especially in Bangalore.",Boot Space,17,0.999999978296873,Performance,23,sttm_42
Its engine performance is super ugly.,Performance,17,0.9832357903100973,Performance,23,sttm_42
The looks of the car are amazing with good ground clearance and great mileage.,Ground Clearance,17,0.5236237593403964,Performance,23,sttm_42
"With all 7 seats up you only get boot space just like a hatchback.
 interior",Boot Space,17,0.9999114991276472,Performance,23,sttm_42
Performance is excellent around the corners and body roll is excellent on the highways.,Performance,17,0.9999362186540031,Performance,23,sttm_42
Great comfortable seating and excellent ground clearance getting in this car.,Ground Clearance,17,0.9455069257813028,Performance,23,sttm_42
"Legroom is good, boot space is better, infotainments are good, the engine is powerful",Boot Space,17,0.9999886627041276,Performance,23,sttm_42
It provides great comfort and good driving experience and it comes to a powerful engine and provides a powerful performance.,Performance,17,0.9999891527022314,Performance,23,sttm_42
"Excellent performance, power is great, and boot space is great.",Performance,17,0.9997555839975882,Performance,23,sttm_42
Excellent car with good ground clearance.,Ground Clearance,17,0.5187871283293031,Performance,23,sttm_42
"This car has amazing performance, leg space, boot space is amazing.",Boot Space,17,0.9999986348566139,Performance,23,sttm_42
"Space of compass is enough for 5 people, but the rear seats are uncomfortably vertical, causing pains and cramps in the abdomen for a bit fat people on long drives.",Comfort,17,0.9999999843951616,Performance,23,sttm_42
Overall driving was comfortable given a lot of equipment has been used to smoothen your ride.,Comfort,17,0.9998386071130954,Performance,23,sttm_42
Boot space is also nice.,Boot Space,17,0.9151412773583623,Performance,23,sttm_42
