The build quality is nice.,Build Quality,25,0.7559455,Build Quality,6,wAd_lda_42
"So Kia had to compromise on some bell/whistle, to keep the price competitive and unfortunately, they decided to compromise on six airbags.",Safety Features,25,0.91124475,Build Quality,6,wAd_lda_42
Features as standard across all variants like ventilated disc brakes all around and dual airbags.,Safety Features,38,0.78565156,Safety Features,5,wAd_lda_42
"In your case, the life with Toyota has been even longer than ours, so, getting down to endeavour is in itself a slight risk (what with higher cost of maintenance, uncertain future of ford in India, low mileage, tight interior space (we found the back seat space relatively tighter than Fortuner), unusable third row, very high stance (difficult for elders) etc, that going for Mahindra maybe a even worse case scenario.",Cost,38,0.5712418,Safety Features,5,wAd_lda_42
It doesn't even have disc brakes in rear.,Safety Features,38,0.48467383,Safety Features,5,wAd_lda_42
"Overall, very comfortable.",Comfort,38,0.6745832,Safety Features,5,wAd_lda_42
Rear disc brakes missing,Safety Features,38,0.38925955,Safety Features,5,wAd_lda_42
"Very spacious, comfortable, features enabled and very nice infotainment system.",Infotainment System,38,0.8779703,Safety Features,5,wAd_lda_42
Excellent infotainment system support system android auto and apple car play and many more features.,Infotainment System,38,0.64691705,Safety Features,5,wAd_lda_42
Overall the harrier looks much smarter.,Looks,38,0.80475307,Safety Features,5,wAd_lda_42
It looks smaller than Creta and in my honest opinion has very less road presence.,Road Presence,38,0.60735184,Safety Features,5,wAd_lda_42
The disc brakes do a great job,Safety Features,38,0.5059322,Safety Features,5,wAd_lda_42
"Brakes, discs not confirmed for all variants yet.",Safety Features,38,0.75593555,Safety Features,5,wAd_lda_42
"So if anyone wants to buy a good family car, then mg hector is the best choice.",Family Car,39,0.90237635,Comfort,9,wAd_lda_42
Those rims look very classic and taking the car to the next level.,Looks,39,0.4669534,Comfort,9,wAd_lda_42
Also a very much comfortable car for a small family.,Comfort,39,0.8047477,Comfort,9,wAd_lda_42
It feels that u r driving luxury SUV good in highways and a family car with good ac smooth drive with space and 7 people can easily sit and go for a long drive,Family Car,39,0.8614633,Comfort,9,wAd_lda_42
Good family car.,Family Car,39,0.75594854,Comfort,9,wAd_lda_42
It is a very safe car with solid chassis and 7 airbag like features.,Safety Features,39,0.6857931,Comfort,9,wAd_lda_42
"Comfort levels on uneven roads is a little jolty I don't like the way the car undulates, the suspension setting is on the harder side.",Comfort,39,0.9302561,Comfort,9,wAd_lda_42
It's a perfect family car.,Family Car,39,0.45509985,Comfort,9,wAd_lda_42
I reduced the psi to 33.5 on all tires still not very comfortable.,Comfort,39,0.34127635,Comfort,9,wAd_lda_42
"So, in the end, I would like to say it’s a perfect family car.",Family Car,39,0.3548273,Comfort,9,wAd_lda_42
The car is very comfortable to drive with a good music system.,Infotainment System,39,0.43513322,Comfort,9,wAd_lda_42
Has a very good road presence looks even better than many cars on the road and it will make you feel like the boss of the road.,Road Presence,39,0.62407005,Comfort,9,wAd_lda_42
"Car is very impressive, comfortable, safe and powerful.",Comfort,39,0.41528505,Comfort,9,wAd_lda_42
Good performance feel like a king ride balancing is a too good family car with a comfortable interior is so good car shape,Family Car,39,0.79140216,Comfort,9,wAd_lda_42
Hector is a good family car according to me.,Family Car,39,0.35544065,Comfort,9,wAd_lda_42
"Wheel size was supposed to be big but cost-cutting came in place, wheels are too small",Cost,39,0.7251015,Comfort,9,wAd_lda_42
"The car is very spacious, comfortable to drive even in city traffic.",Comfort,39,0.8605399,Comfort,9,wAd_lda_42
"Awesome drive, smooth, comfortable, stylish, picnic family car.",Family Car,39,0.39721188,Comfort,9,wAd_lda_42
"It's very comfortable for a long drive, I drive on 160 and gives very good performance",Performance,39,0.40671438,Comfort,9,wAd_lda_42
And it is a very comfortable car and very good looking car,Looks,39,0.65868014,Comfort,9,wAd_lda_42
Sporty and comfortable vehicle for a family.,Comfort,39,0.35884503,Comfort,9,wAd_lda_42
The sunroof has also added a good look to the level of the car.,Sunroof,39,0.3531726,Comfort,9,wAd_lda_42
It drives like a sedan and is very comfortable car.,Comfort,39,0.8047583,Comfort,9,wAd_lda_42
"The driving comfort is good, pickup is fantastic.",Comfort,39,0.3858444,Comfort,9,wAd_lda_42
This is the best SUV between 30lakethis is the best comfortable car in this segment is speed,Comfort,39,0.89153105,Comfort,9,wAd_lda_42
This car is more comfortable and the performance is also very good.,Performance,39,0.52301335,Comfort,9,wAd_lda_42
This is how price inflation is happening unnecessarily in every sector and things are getting costlier..!,Cost,27,0.7490572,Cost,2,wAd_lda_42
Very high standard car and the tire is massive.fully electronic systems and safe car.,Safety Features,27,0.6081465,Cost,2,wAd_lda_42
In 3 months I have gone 6 times to the service center and talking about the music system and engine noise is again a big problem.,Infotainment System,27,0.83450365,Cost,2,wAd_lda_42
4-year service is slightly costlier.,Cost,27,0.50595355,Cost,2,wAd_lda_42
"The build quality is commendable (both exterior and interior), far better than cars in the same segment.",Build Quality,27,0.5070578,Cost,2,wAd_lda_42
I love the style and design of this car but there is no wireless charging in this vehicle.,Wireless Charging,20,0.8779699,Comfort,6,wAd_lda_42
Yah available hai wireless charging,Wireless Charging,20,0.75592595,Comfort,6,wAd_lda_42
", boot space is good, ground clearance is good, it will help for bumpy roads, unethical speed breakers especially in Bangalore.",Boot Space,20,0.6074717,Comfort,6,wAd_lda_42
* I think it may feel some uncomfortable for 6 feet person to site in the back seat.,Comfort,20,0.604325,Comfort,6,wAd_lda_42
Great comfortable seating and excellent ground clearance getting in this car.,Ground Clearance,20,0.89152974,Comfort,6,wAd_lda_42
Very comfortable SUV compared to other cars.,Comfort,20,0.804758,Comfort,6,wAd_lda_42
The seating is really comforting.,Comfort,20,0.5118772,Comfort,6,wAd_lda_42
Such a comfortable seating.,Comfort,20,0.6745911,Comfort,6,wAd_lda_42
"An excellent car to drive, super stability and road presence.",Road Presence,20,0.7884711,Comfort,6,wAd_lda_42
looks and performance are excellent.,Performance,20,0.2832374,Comfort,6,wAd_lda_42
"Wireless charging pad) a boon, i am glad that i don't have it, mainly because:
 1) i don't have wireless charging in my phone.",Wireless Charging,20,0.90237314,Comfort,6,wAd_lda_42
The performance of the car is excellent.,Performance,20,0.75593424,Comfort,6,wAd_lda_42
It is a car with fun and style with unique performance.,Performance,20,0.4988353,Comfort,6,wAd_lda_42
Good performance and maintenance cost is affordable.comfort driving and many features are available in this car especially in this series.,Cost,20,0.91863847,Comfort,6,wAd_lda_42
I can't even express the comfort and the fun while driving it..it is was totally amazing by all sides concern...and I am going to purchase my car in the coming Dussehra 019...,Comfort,20,0.67435694,Comfort,6,wAd_lda_42
It is a very comfortable SUV and powerful as well.,Comfort,20,0.5059537,Comfort,6,wAd_lda_42
My favorite feature of the car is wireless charging,Wireless Charging,20,0.51141524,Comfort,6,wAd_lda_42
You are gonna have a long fight for the sunroof thing,Sunroof,12,0.396855,Sunroof,5,wAd_lda_42
The suv has a panoramic sunroof and is also fitted with new dual-tone alloy wheels.,Sunroof,12,0.90237325,Sunroof,5,wAd_lda_42
Fortuner is comfortable for a long journey.,Comfort,12,0.57417154,Sunroof,5,wAd_lda_42
The 10 speaker music system sound amazing.,Infotainment System,12,0.83729494,Sunroof,5,wAd_lda_42
It is comfortable for a long journey.,Comfort,12,0.75591296,Sunroof,5,wAd_lda_42
A panoramic sunroof with all-wheel disc brakes will certainly motivate me buying this beast.,Sunroof,12,0.9023719,Sunroof,5,wAd_lda_42
The height of the car and the ground clearance is superb for Indian roads.,Ground Clearance,12,0.6656082,Sunroof,5,wAd_lda_42
"The touch screen infotainment system and the speaker's output is amazing, the tires should be improved.",Infotainment System,12,0.90237397,Sunroof,5,wAd_lda_42
The steering is light and comfortable for a long journey.,Comfort,12,0.83728284,Sunroof,5,wAd_lda_42
Reverse camera resolution & clarity is good enough even at night.,Safety Features,12,0.79941744,Sunroof,5,wAd_lda_42
A massive suv in the indian market after a long time with excellent performance.,Performance,12,0.6467856,Sunroof,5,wAd_lda_42
"Rattles keep coming up from all over the body, specifically the left side,
 8. under-thigh support in the seats is less, which may lead to fatigue in long journeys for taller drivers,
 9.",Comfort,12,0.8336946,Sunroof,5,wAd_lda_42
He claims his infotainment system was acting weird since purchase 3 months ago.,Infotainment System,12,0.89152575,Sunroof,5,wAd_lda_42
Why is there no panoramic sunroofthe only disappointment 😟,Sunroof,12,0.51189184,Sunroof,5,wAd_lda_42
The panoramic sunroof gives a beautiful experience of surroundings.,Sunroof,12,0.8605343,Sunroof,5,wAd_lda_42
It comes with sportive looks great road presence.,Road Presence,12,0.3577349,Sunroof,5,wAd_lda_42
"Hopefully, they will change their infotainment system that has driven most owners insane with software updates after software updates that don't fix anything.",Infotainment System,12,0.8341661,Sunroof,5,wAd_lda_42
Built quality is very solid and a quick peppy engine.,Build Quality,2,0.49263254,Looks,7,nAd_lda_42
I am absolutely disappointed with the lack of safety features in the tech line.,Safety Features,2,0.67460096,Looks,7,nAd_lda_42
"This is the base petrol model, doesn't even have a sunroof nor front parking sensors.",Sunroof,2,0.86053896,Looks,7,nAd_lda_42
Safety features are good with six airbags and other features such as abs ebd.,Safety Features,2,0.50520337,Looks,7,nAd_lda_42
Black looks so good,Looks,2,0.86053795,Looks,7,nAd_lda_42
"Also, the 1.8 tsi (even the 1.4tsi) offers explosive performance which no car <25 lakhs can match.",Performance,2,0.32796255,Looks,7,nAd_lda_42
"gtx with dct which most people are after does miss out on quite a few features like:-
 sunroof, bose system, ventilated seats etc",Ventilated Seats,2,0.3256738,Looks,7,nAd_lda_42
I think it's worthless in waiting for this hector engine performance.,Performance,2,0.75594676,Looks,7,nAd_lda_42
It's a better performer than its rivals.,Performance,2,0.67460096,Looks,7,nAd_lda_42
"The safety feature included airbags, ebd, traction control system, esp, hill hold control, hill descent control.",Safety Features,2,0.43968588,Looks,7,nAd_lda_42
The headlights and shoulder line gives a masculine look.,Looks,2,0.8779733,Looks,7,nAd_lda_42
The panoramic sunroof/moonroof is breathtaking and makes us feel good.,Sunroof,2,0.4990498,Looks,7,nAd_lda_42
Boot space is also nice.,Boot Space,2,0.7420839,Looks,7,nAd_lda_42
Smooth and comfortable long drives.,Comfort,2,0.67460096,Looks,7,nAd_lda_42
Looking so stylish and a new generation SUV car today.,Looks,2,0.67460096,Looks,7,nAd_lda_42
"Yes, very poor under-thigh support.",Comfort,2,0.75594246,Looks,7,nAd_lda_42
The safety features are amazing.,Safety Features,2,0.8605364,Looks,7,nAd_lda_42
"A couple of months before they launched the latest trims with panoramic sunroof and wireless charger etc. since my family is very happy with the car, we decided to take the plunge once again",Wireless Charging,2,0.50392514,Looks,7,nAd_lda_42
So it looks quite good on the outside.,Looks,2,0.5118962,Looks,7,nAd_lda_42
Very spacious car with pretty good features and establishes a bold look.,Looks,2,0.80475825,Looks,7,nAd_lda_42
Good to see kia cover almost all the major bases from compliance to auto transmissions to the sunroof.,Sunroof,2,0.4892291,Looks,7,nAd_lda_42
Bose sound quality is awesome.,Infotainment System,2,0.67460096,Looks,7,nAd_lda_42
"More space, excellent ride, and build quality, and",Build Quality,2,0.5119011,Looks,7,nAd_lda_42
I love its full sunroof,Sunroof,2,0.588126,Looks,7,nAd_lda_42
"Riding comfort and riding feel are good, but poor mileage, exterior, and the interior are very good, road presence is very good, service cost is expensive, bad experience in bad roads, interior plastic quality is not good.",Comfort,2,0.3864365,Looks,7,nAd_lda_42
Cost 25 lac too much for this much features,Cost,2,0.67459846,Looks,7,nAd_lda_42
It so comfortable and it is feature loaded along with a sunroof also with the comfortable automatic nice car we will rate it 5 stars.,Sunroof,2,0.67460096,Looks,7,nAd_lda_42
It is a great car in this reasonable price range.,Cost,2,0.40477327,Looks,7,nAd_lda_42
"It's very comfortable for a long drive, I drive on 160 and gives very good performance",Performance,2,0.5999928,Looks,7,nAd_lda_42
"Posh looks and superb performance, the complete family car.",Family Car,2,0.67460096,Looks,7,nAd_lda_42
"You will get a full package at an affordable price, loved it.",Cost,2,0.5059697,Looks,7,nAd_lda_42
The car is superbly built and the road presence is unbeatable.,Road Presence,2,0.5118961,Looks,7,nAd_lda_42
The build quality is nice.,Build Quality,2,0.45834208,Looks,7,nAd_lda_42
It is an excellent suv which scores on safety features and excellent all-round performances.,Safety Features,2,0.49934348,Looks,7,nAd_lda_42
"And of course, the panoramic sunroof makes the cabin more luxuries.",Sunroof,2,0.67460096,Looks,7,nAd_lda_42
Both variants have their own comfort.,Comfort,2,0.6745982,Looks,7,nAd_lda_42
It's looking great.,Looks,2,0.5118962,Looks,7,nAd_lda_42
"Very bad experience from the start, to date every day have been running to their service center, car frequently stalls when changing gear from third to second, touch screen infotainment system got hung, then blacked out, was replaced by the company & still has issues.",Infotainment System,2,0.804753,Looks,7,nAd_lda_42
Because the built and looks of the compass are exceptionally great.,Looks,2,0.83729726,Looks,7,nAd_lda_42
This car is more comfortable and the performance is also very good.,Performance,2,0.50461704,Looks,7,nAd_lda_42
Even it's base model has all features and safety like traction control abs ebd etc,Safety Features,19,0.7791085,Safety Features,4,nAd_lda_42
All safety features are available in gl itself.,Safety Features,19,0.8372921,Safety Features,4,nAd_lda_42
", boot space is good, ground clearance is good, it will help for bumpy roads, unethical speed breakers especially in Bangalore.",Boot Space,19,0.5118957,Safety Features,4,nAd_lda_42
The most sensational panoramic sunroof has got automatic folding and unfolding cover of the glass.,Sunroof,19,0.34126753,Safety Features,4,nAd_lda_42
"Better build quality 
 much better engines 
 proven the test of time",Build Quality,19,0.3497635,Safety Features,4,nAd_lda_42
And yes they put it on the right price tag,Cost,19,0.6745748,Safety Features,4,nAd_lda_42
"Excellent ground clearance, sturdy looks and feels like a king when steering in the highway as well as the city.",Ground Clearance,19,0.2634548,Safety Features,4,nAd_lda_42
"Good car, fabulous model, fantastic interiors, and unbelievable SUV.",Looks,19,0.8372934,Safety Features,4,nAd_lda_42
"Diesel auto will miss out on side and curtain airbags, 360 camera, blind spot monitor, heads-up display.",Safety Features,19,0.4854106,Safety Features,4,nAd_lda_42
Love the safety features,Safety Features,19,0.7038588,Safety Features,4,nAd_lda_42
Jeep India replaced the burst tire free of cost as a goodwill gesture.,Cost,19,0.61548555,Safety Features,4,nAd_lda_42
Hector is a good family car according to me.,Family Car,19,0.8915276,Safety Features,4,nAd_lda_42
"A lot of negatives than positives, but one thing the system is performing poorly.",Performance,19,0.5129474,Safety Features,4,nAd_lda_42
Good road presence and amazing built quality.,Road Presence,19,0.25598368,Safety Features,4,nAd_lda_42
This is a very handsome looking car.,Looks,19,0.5118956,Safety Features,4,nAd_lda_42
"The hud, the sunroof was more of feel-good factors.",Sunroof,19,0.8047576,Safety Features,4,nAd_lda_42
Car quality is looking very good,Looks,19,0.6745907,Safety Features,4,nAd_lda_42
Jeep compass is a high performance vehicle with overall specifications is very excellent.,Performance,19,0.6710421,Safety Features,4,nAd_lda_42
The diesel engine is providing extreme performance to the car like a beast.,Performance,27,0.49390998,Safety Features,3,nAd_lda_42
But the worst thing I felt is the last seat is low no thigh support and the window for the 3rd row is very small.,Comfort,27,0.72760737,Safety Features,3,nAd_lda_42
The main thing I like about the car is its build quality.,Build Quality,27,0.26371142,Safety Features,3,nAd_lda_42
The suv has a panoramic sunroof and is also fitted with new dual-tone alloy wheels.,Sunroof,27,0.5039358,Safety Features,3,nAd_lda_42
Looks like the trailhawk is missing the front parking sensors and the beats audio available on their international trims.,Safety Features,27,0.6362214,Safety Features,3,nAd_lda_42
"The model comes fully loaded with features like 6 airbags, esp, abs, traction control, esc and isofix anchor points.",Safety Features,27,0.5857503,Safety Features,3,nAd_lda_42
"Wireless charging pad) a boon, i am glad that i don't have it, mainly because:
 1) i don't have wireless charging in my phone.",Wireless Charging,27,0.5118906,Safety Features,3,nAd_lda_42
Mahindra xuv500 has a very powerful engine but built quality not perfect also other parts like breaking system is very poor.,Build Quality,27,0.5007579,Safety Features,3,nAd_lda_42
Those wheels are horrible looking,Looks,27,0.8047552,Safety Features,3,nAd_lda_42
Real off-road car with premium looks.,Road Presence,27,0.93026674,Safety Features,3,nAd_lda_42
The new design comes with completely stunning looks also it has a power-packed performance.,Performance,27,0.654731,Safety Features,3,nAd_lda_42
Stunning look,Looks,27,0.6556291,Safety Features,3,nAd_lda_42
Its maintenance cost is affordable easily.,Cost,27,0.7559289,Safety Features,3,nAd_lda_42
Jeep compass is an excellent suv which scores on safety features and excellent all round performances.,Safety Features,27,0.91125125,Safety Features,3,nAd_lda_42
It's not a car but its the best option in this price range.,Cost,27,0.22070129,Safety Features,3,nAd_lda_42
The black and white colors look very aesthetic.,Looks,0,0.023809524,Performance,4,nAd_lda_42
One of the worst bose systems I have seen is in this car,Infotainment System,0,0.8779585,Performance,4,nAd_lda_42
"Ground clearance-10/10 
 suitable for most of the bad roads and the soft suspension makes low speed rides on bad roads heaven.",Ground Clearance,0,0.023809524,Performance,4,nAd_lda_42
It’s n amazing car with great features & value for money.,Cost,0,0.5057877,Performance,4,nAd_lda_42
non availability of ventilated seats,Ventilated Seats,0,0.51189584,Performance,4,nAd_lda_42
It has large wheels and decent boot space.,Boot Space,0,0.51189584,Performance,4,nAd_lda_42
Great engine and great experience like it too much insane performance.,Performance,0,0.023809524,Performance,4,nAd_lda_42
Its road presence is awesome and the interior is very good.,Road Presence,0,0.80891377,Performance,4,nAd_lda_42
It stands apart and my favorite is its electric sunroof which opens with the human voice.,Sunroof,0,0.5017611,Performance,4,nAd_lda_42
It has very new looks and has a fantastic performance.,Performance,0,0.8605401,Performance,4,nAd_lda_42
"The car looks stunning, period.",Looks,0,0.7316433,Performance,4,nAd_lda_42
Though this cost impact is not prohibitively high considering the utility.,Cost,0,0.023809524,Performance,4,nAd_lda_42
"Complete family car, safety-wise good.",Family Car,0,0.023809524,Performance,4,nAd_lda_42
It has full pickup performance and the long drive performance is good.,Performance,0,0.67459655,Performance,4,nAd_lda_42
"Build quality and interior is quite good, the ride is also quite good.",Build Quality,0,0.90236914,Performance,4,nAd_lda_42
"Very attracting performance, good experience to drive a long drive.",Performance,0,0.8605383,Performance,4,nAd_lda_42
It is because of its mediocre music system.,Infotainment System,0,0.41540974,Performance,4,nAd_lda_42
95k for that small sunroof.,Sunroof,0,0.9023746,Performance,4,nAd_lda_42
Looks mind-blowingly good!,Looks,0,0.5118959,Performance,4,nAd_lda_42
Maintainance cost is very less I would say negligible.,Cost,26,0.36902258,Road Presence,4,nAd_lda_42
More space and a much better road presence.,Road Presence,26,0.6840696,Road Presence,4,nAd_lda_42
"In the interior, it has got many features like the 8-inch touch screen infotainment system with reverse parking sensors with a camera.",Infotainment System,26,0.36647478,Road Presence,4,nAd_lda_42
Performance very bad experience,Performance,26,0.6532775,Road Presence,4,nAd_lda_42
Looks are so lame...,Looks,26,0.6047614,Road Presence,4,nAd_lda_42
It's a complete package of luxury and comfort.,Comfort,26,0.80234903,Road Presence,4,nAd_lda_42
I'm 5.9 and I feel uncomfortable in the third row due to lack of under-thigh support and leg space.,Comfort,26,0.5449648,Road Presence,4,nAd_lda_42
The road presence of the car is fabulous...,Road Presence,26,0.39028442,Road Presence,4,nAd_lda_42
The build quality is very high.,Build Quality,26,0.42406613,Road Presence,4,nAd_lda_42
"Toyota car build-up quality is also good, very fun to drive, as u know in Toyota cars there is very low servicing & maintenance cost",Build Quality,26,0.8605353,Road Presence,4,nAd_lda_42
Overall it feels like a good place to be in with its panoramic sunroof and black and beige interiors.,Sunroof,26,0.6791497,Road Presence,4,nAd_lda_42
Amazing look with awesome performance.,Performance,26,0.58695984,Road Presence,4,nAd_lda_42
The height of the car and the ground clearance is superb for Indian roads.,Ground Clearance,26,0.5260424,Road Presence,4,nAd_lda_42
Such a comfortable seating.,Comfort,26,0.8372925,Road Presence,4,nAd_lda_42
For jeep compass 1 thousand dislikes I hate this car it's very costly,Cost,26,0.91124314,Road Presence,4,nAd_lda_42
Service n maintenance cost is a little bit high.,Cost,26,0.39795518,Road Presence,4,nAd_lda_42
Striking design with a great road presence.,Road Presence,26,0.87796915,Road Presence,4,nAd_lda_42
Studded front grill along with cheetah inspired muscular body gives it a very powerful road presence which cannot be ignored while driving.,Road Presence,26,0.7017874,Road Presence,4,nAd_lda_42
"the real deal breakers are the sunroof, powered seats, the 360 deg camera and the ventilated seats.",Ventilated Seats,40,0.6176601,Comfort,5,nAd_lda_42
Poor build quality.,Build Quality,40,0.40007153,Comfort,5,nAd_lda_42
"The safety features and obviously, long-running performance make it all worth it!",Performance,40,0.4451705,Comfort,5,nAd_lda_42
"Could have added more features like auto parking,front sensor and all the door glasses automatically closes when it is locked.",Safety Features,40,0.6745954,Comfort,5,nAd_lda_42
It looks like a sturdy and smart car.,Looks,40,0.45440823,Comfort,5,nAd_lda_42
Very high standard car and the tire is massive.fully electronic systems and safe car.,Safety Features,40,0.67459553,Comfort,5,nAd_lda_42
If you are fond of big cars and want to have a good road presence then it is the best car at this price point.,Road Presence,40,0.67459553,Comfort,5,nAd_lda_42
the performance of the 2.0l engine was also best.,Performance,40,0.755945,Comfort,5,nAd_lda_42
It is comfortable for a long journey.,Comfort,40,0.89152664,Comfort,5,nAd_lda_42
Very comfortable SUV compared to other cars.,Comfort,40,0.5895439,Comfort,5,nAd_lda_42
The seating is really comforting.,Comfort,40,0.67459553,Comfort,5,nAd_lda_42
The seats are pretty comfortable.,Comfort,40,0.3372989,Comfort,5,nAd_lda_42
the jeep put a smile on my face with its performance.,Performance,40,0.755945,Comfort,5,nAd_lda_42
1. build quality definitely not better than Creta.,Build Quality,40,0.8372894,Comfort,5,nAd_lda_42
Good ground clearance.,Ground Clearance,40,0.755945,Comfort,5,nAd_lda_42
"The car is very convenient, comfortable and affordable.",Comfort,40,0.59694123,Comfort,5,nAd_lda_42
The infotainment system is too good for sound quality is awesome.,Infotainment System,40,0.4299262,Comfort,5,nAd_lda_42
"Sporty look, interior segments designed good and are easily accessible.",Looks,40,0.67459553,Comfort,5,nAd_lda_42
"Mg has a voice controller, internet, sunroof and a large amount of boot space.",Boot Space,40,0.8639833,Comfort,5,nAd_lda_42
I would say that driving experience was very good and the sunroof is awesome in this price segment.,Sunroof,40,0.4229187,Comfort,5,nAd_lda_42
Good looking stylish car of the year.,Looks,40,0.837298,Comfort,5,nAd_lda_42
"Its performance is phenomenal, outstanding and off-roading capabilities are awesome.",Performance,40,0.67459553,Comfort,5,nAd_lda_42
"Hopefully, the resale value of my 2018 Creta will improve once Hyundai launches this horrible looking one in 2020!",Looks,40,0.5021454,Comfort,5,nAd_lda_42
The all black interiors make it pretty classy and the panoramic sunroof makes the cabin feel airy.,Sunroof,21,0.87797314,Safety Features,4,nAd_lda_42
"New goodies: sunroof, wireless charging etc.",Wireless Charging,21,0.6834829,Safety Features,4,nAd_lda_42
