That sunroof is sweet!,Sunroof,39,0.8915224,Cost,4,nAd_lda_42
"Car is very impressive, comfortable, safe and powerful.",Comfort,39,0.6778956,Cost,4,nAd_lda_42
This car looks very attractive I love this car and they give u more power and advanced features,Looks,39,0.79980314,Cost,4,nAd_lda_42
Powerful pack with a suitable pocket cost.,Cost,39,0.56581986,Cost,4,nAd_lda_42
"There could be few features which adds value for a customer in htx+ like auto ac, ventilated seats if you prioritize comfort",Ventilated Seats,39,0.3325347,Cost,4,nAd_lda_42
"Features that always surprises me is touchscreen systems with user friendly interface, wireless charging etc.",Wireless Charging,39,0.8047551,Cost,4,nAd_lda_42
"There were so many facilities like wireless charging, etc.",Wireless Charging,39,0.7559387,Cost,4,nAd_lda_42
I can feel how uncomfortable this is for passengers as well as drivers,Comfort,37,0.42168373,Comfort,3,nAd_lda_42
"They should work on the infotainment system, tire Tronics and some other basic features and no one will be in que to compete with them because everything else is perfect.",Infotainment System,37,0.34132066,Comfort,3,nAd_lda_42
Large boot space is available.,Boot Space,37,0.6935828,Comfort,3,nAd_lda_42
"Overall, very comfortable.",Comfort,37,0.5697205,Comfort,3,nAd_lda_42
Super drive quality and awesome road presence.,Road Presence,37,0.34132686,Comfort,3,nAd_lda_42
"Very comfortable car, It is very brilliant love you Alturas g4.",Comfort,37,0.74650276,Comfort,3,nAd_lda_42
"Hopefully, they will change their infotainment system that has driven most owners insane with software updates after software updates that don't fix anything.",Infotainment System,37,0.3446327,Comfort,3,nAd_lda_42
Saw the car on the road today and i found it to have good enough road presence.,Road Presence,51,0.9994642540565671,Build Quality,42,sttm_77
Built quality is very solid and a quick peppy engine.,Build Quality,51,0.999825267943253,Build Quality,42,sttm_77
It has very weak road presence compared to even a creta.,Road Presence,51,0.9786992108474764,Build Quality,42,sttm_77
Poor build quality.,Build Quality,51,0.9933405913631231,Build Quality,42,sttm_77
"Speed, average and built quality and interiors are good.",Build Quality,51,0.9991855835982381,Build Quality,42,sttm_77
Performance is very well highly trustable in terms of engine and builds quality.,Performance,51,0.9999990471375725,Build Quality,42,sttm_77
Premium look and highly fuel-efficient compared to other SUVs which fall under this price range.,Looks,51,0.9999632896541969,Build Quality,42,sttm_77
But yeah this iteration of the Creta looks terrible.,Looks,51,0.9166000931233544,Build Quality,42,sttm_77
Black looks so good,Looks,51,0.31797050521697173,Build Quality,42,sttm_77
More space and a much better road presence.,Road Presence,51,0.9572990216048543,Build Quality,42,sttm_77
The built quality of the car is solid with a good pick up power.,Build Quality,51,0.99998689671101,Build Quality,42,sttm_77
"Not really impressed with the built quality, exterior look flashy but not robust.",Build Quality,51,0.9999271255814298,Build Quality,42,sttm_77
"Never expected such a marvel from Mahindra, they have rocked the market, value for money, excellent build quality, features, and remarkable power.",Build Quality,51,0.9999999911523757,Build Quality,42,sttm_77
"the car has soo many safety features, that is awesome",Safety Features,51,0.46233497184205774,Build Quality,42,sttm_77
Looks are so lame...,Looks,51,0.31797050521697173,Build Quality,42,sttm_77
It combines premium build quality with all the latest technologies to offer a premium quality experience.,Build Quality,51,0.9999998195004052,Build Quality,42,sttm_77
"This car is very smooth and powerful than other cars at this price,Mahindra XUV is the best safe car than other Mahindra car these power and torque very good, infotainment system are so nice",Infotainment System,51,0.9998855773985037,Build Quality,42,sttm_77
It has the best ground clearance in the segment and its cabin is more spacious than other and it is value for money product,Ground Clearance,51,0.9997563078422164,Build Quality,42,sttm_77
The Mahindra xuv500 is a very poor quality car.,Build Quality,51,0.9997788345255745,Build Quality,42,sttm_77
The road presence of the car is fabulous...,Road Presence,51,0.7015976566744289,Build Quality,42,sttm_77
This car has amazing safety features and strong built quality.,Build Quality,51,0.9998888132205527,Build Quality,42,sttm_77
"Not that much costly...look and performance vise better than others, I recommend to myself..to buy this one",Cost,51,0.9998572015748038,Build Quality,42,sttm_77
"Mg hector is a very high technology car, and I love it and this car price is also less as compared to its feature and this car is having nice ground clearance and this car is fabulous.",Ground Clearance,51,0.999999948768188,Build Quality,42,sttm_77
"So if anyone wants to buy a good family car, then mg hector is the best choice.",Family Car,51,0.9997580034456226,Build Quality,42,sttm_77
Poor quality and road presence.,Road Presence,51,0.9847693780739591,Build Quality,42,sttm_77
"in safety features, harrier is an average.",Safety Features,51,0.8388325471930739,Build Quality,42,sttm_77
I think it's worthless in waiting for this hector engine performance.,Performance,51,0.9996638940838746,Build Quality,42,sttm_77
It looks horrible from the side.,Looks,51,0.31797050521697173,Build Quality,42,sttm_77
The build quality is very high.,Build Quality,51,0.9933405913631231,Build Quality,42,sttm_77
The main thing I like about the car is its build quality.,Build Quality,51,0.9994980218087107,Build Quality,42,sttm_77
I have bought orcas white and it looks classy.,Looks,51,0.9725897722366941,Build Quality,42,sttm_77
"The main reasons are 
 - pathetic build quality
 - below average service experience
 - poor brand image
 - long term reliability",Build Quality,51,0.9999964095137072,Build Quality,42,sttm_77
It has a very imposing road presence.,Road Presence,51,0.7865070822876116,Build Quality,42,sttm_77
", it is not good looking.",Looks,51,0.31797050521697173,Build Quality,42,sttm_77
A strong road presence and classy interiors are certainly the best compared to jeep compass and harrier.,Road Presence,51,0.9999950586728886,Build Quality,42,sttm_77
"Jeep compass build quality, interior design, and quality are top-notch.",Build Quality,51,0.9999995229949149,Build Quality,42,sttm_77
Its engine performance is super ugly.,Performance,51,0.9734609496058694,Build Quality,42,sttm_77
Atrocious looks.,Looks,51,0.31797050521697173,Build Quality,42,sttm_77
If you are fond of big cars and want to have a good road presence then it is the best car at this price point.,Road Presence,51,0.9998697049537935,Build Quality,42,sttm_77
"Better build quality 
 much better engines 
 proven the test of time",Build Quality,51,0.9999999403265674,Build Quality,42,sttm_77
We enthusiasts love the build quality and driving dynamics of the compass.,Build Quality,51,0.9999907318494832,Build Quality,42,sttm_77
It looks very cool in red,Looks,51,0.31797050521697173,Build Quality,42,sttm_77
It looks really bad and fit is even worse.,Looks,51,0.31797050521697173,Build Quality,42,sttm_77
It has some good list of features and most importantly has a tempting road presence that every Indian car buyer always wants.,Road Presence,51,0.9999915233076698,Build Quality,42,sttm_77
"Price is little over for top-end model
 good ride quality 
 built quality is awesome.",Build Quality,51,0.9984654095476587,Build Quality,42,sttm_77
"Mg hector is such a comfortable car, and its look is fantastic.",Looks,51,0.9965162392342275,Build Quality,42,sttm_77
It does look hideous and unappealing in the images.,Looks,51,0.8480951505441667,Build Quality,42,sttm_77
Mg hector is going to be the best car under 20lk and the best family tour car too.,Family Car,51,0.9995702153231872,Build Quality,42,sttm_77
Excellent build quality which offers better protection to occupants.,Build Quality,51,0.9997907440477097,Build Quality,42,sttm_77
The front looks shit,Looks,51,0.7451881554769013,Build Quality,42,sttm_77
"I found it to be a great overall package, with a great engine and excellent interior space and good road presence.",Road Presence,51,0.999124002465123,Build Quality,42,sttm_77
Value for money awesome this is value for money superpower and build quality this is a fortune to own a Fortuner I would recommend you to buy this .it gives fair milage,Build Quality,51,0.9999998851863633,Build Quality,42,sttm_77
"So, in the end, I would like to say it’s a perfect family car.",Family Car,51,0.5172899238097726,Build Quality,42,sttm_77
It's nothing compared to its rivals... interiors are great...but it lacks far behind when it comes to exterior looks...,Looks,51,0.9942743333557783,Build Quality,42,sttm_77
The front grill helps this car to get an amazing road presence.,Road Presence,51,0.9716211116669011,Build Quality,42,sttm_77
The built quality is nice.,Build Quality,51,0.9933405913631231,Build Quality,42,sttm_77
Build quality is also amazing......,Build Quality,51,0.9933405913631231,Build Quality,42,sttm_77
A massive suv in the indian market after a long time with excellent performance.,Performance,51,0.9470458969131584,Build Quality,42,sttm_77
But the interior is outdated and doesn't really give it mordern look.,Looks,51,0.31797050521697173,Build Quality,42,sttm_77
"The car performance is superb, good pick up and attractive look.",Performance,51,0.9797515299125817,Build Quality,42,sttm_77
It is better looks and better performance.,Looks,51,0.831879340235052,Build Quality,42,sttm_77
The exteriors look horrible.,Looks,51,0.5882960376159422,Build Quality,42,sttm_77
"The car looks stunning, period.",Looks,51,0.755183644210914,Build Quality,42,sttm_77
"The build quality is commendable (both exterior and interior), far better than cars in the same segment.",Build Quality,51,0.9999715522449147,Build Quality,42,sttm_77
It looks so good!,Looks,51,0.31797050521697173,Build Quality,42,sttm_77
So I know pricing is tough when performance cannot be compromised.,Performance,51,0.9122710034078207,Build Quality,42,sttm_77
"Saw a few pictures on twitter, the red and black car looks stunning!",Looks,51,0.9936507794045721,Build Quality,42,sttm_77
1. build quality definitely not better than Creta.,Build Quality,51,0.9999811821958211,Build Quality,42,sttm_77
Car quality is looking very good,Build Quality,51,0.9922012012403504,Build Quality,42,sttm_77
The looks are nice.,Looks,51,0.31797050521697173,Build Quality,42,sttm_77
And the sound system is the best thing in this car.,Infotainment System,51,0.3666624328258468,Build Quality,42,sttm_77
Mahindra xuv500 has a very powerful engine but built quality not perfect also other parts like breaking system is very poor.,Build Quality,51,0.9999999938459603,Build Quality,42,sttm_77
The build quality was appalling when I sat in the international model(which was btw in mint condition supposedly),Build Quality,51,0.9999847841132601,Build Quality,42,sttm_77
.. it comes with plenty of features.. rich in space and comfort and the Skoda build quality adds up to the value.,Build Quality,51,0.9999999336221514,Build Quality,42,sttm_77
Real off-road car with premium looks.,Road Presence,51,0.9891128424970695,Build Quality,42,sttm_77
A worth buy for quality car lovers!,Build Quality,51,0.9995340056583129,Build Quality,42,sttm_77
The road presence is amazing and dominates every other car in this segment.,Road Presence,51,0.9795703290948791,Build Quality,42,sttm_77
"One of the best cars ever seen .....this can lead to cool life.nice mileage, engine power, and strong build quality.",Build Quality,51,0.9999993480127239,Build Quality,42,sttm_77
"Mg hector is such a comfortable car, and its look is fantastic.",Comfort,51,0.9965162392342275,Build Quality,42,sttm_77
Good road presence and amazing built quality.,Road Presence,51,0.9988649387990209,Build Quality,42,sttm_77
"Build quality and interior is quite good, the ride is also quite good.",Build Quality,51,0.9924618072358616,Build Quality,42,sttm_77
"Build quality, interior part quality, feature list, and space is good.",Build Quality,51,0.9999974200087514,Build Quality,42,sttm_77
Built quality is good.,Build Quality,51,0.9933405913631231,Build Quality,42,sttm_77
The Fortuner look is also very cool.,Looks,51,0.42449984414472147,Build Quality,42,sttm_77
Bose sound quality is awesome.,Infotainment System,51,0.9801978023867708,Build Quality,42,sttm_77
"The amazing car , jeep compass it is expensive",Cost,51,0.8805705811578451,Build Quality,42,sttm_77
Super drive quality and awesome road presence.,Road Presence,51,0.9959765014230642,Build Quality,42,sttm_77
"More space, excellent ride, and build quality, and",Build Quality,51,0.9997452680127585,Build Quality,42,sttm_77
Car looks gorgeous and has road presence.,Road Presence,51,0.7116324820216124,Build Quality,42,sttm_77
Mg hector is a premium car with a great built quality.,Build Quality,51,0.9999999054260202,Build Quality,42,sttm_77
Stunning look,Looks,51,0.31797050521697173,Build Quality,42,sttm_77
Its road presence is too good and it has good safety standards.,Road Presence,51,0.9889801918668087,Build Quality,42,sttm_77
Very good built quality.,Build Quality,51,0.9933405913631231,Build Quality,42,sttm_77
This car has amazing safety features and strong built quality.,Safety Features,51,0.9998888132205527,Build Quality,42,sttm_77
"Amazing experience, best feature best performance on off-road also music system is also good.",Infotainment System,51,0.9964202328843547,Build Quality,42,sttm_77
Perfect size and the premium build quality to go along with it.,Build Quality,51,0.9999755254723525,Build Quality,42,sttm_77
"Sporty look, interior segments designed good and are easily accessible.",Looks,51,0.9038183432961123,Build Quality,42,sttm_77
"My family is not much keen on seltos due to the its size, internal space and road presence.",Road Presence,51,0.9999896902281225,Build Quality,42,sttm_77
Other than that it simply looks fantastic.,Looks,51,0.6496373312960296,Build Quality,42,sttm_77
Build quality is very poor..doors are very light quality.,Build Quality,51,0.9996700290679755,Build Quality,42,sttm_77
Very nice looks,Looks,51,0.31797050521697173,Build Quality,42,sttm_77
It has great looks yes good power and space but in terms of build quality terrible if it falls in a road bump or a medium-size speed breaker the monocoque chassis has band permanently.,Build Quality,51,0.9999999999998994,Build Quality,42,sttm_77
It comes with sportive looks great road presence.,Road Presence,51,0.9794717319781361,Build Quality,42,sttm_77
Fabulous built quality.,Build Quality,51,0.9933405913631231,Build Quality,42,sttm_77
"In terms of value for money, I think at this current price it's a steal as it's less costly than jeep compass but has more features.",Cost,51,0.9999824720083013,Build Quality,42,sttm_77
Ground clearance is good and solid build quality with nice material and leatherwork in the interior.,Ground Clearance,51,0.999931262804105,Build Quality,42,sttm_77
Good looking and excellent build quality and road presence.,Road Presence,51,0.9999671114159137,Build Quality,42,sttm_77
The build quality is best in its segment.,Build Quality,51,0.9996680605076018,Build Quality,42,sttm_77
The car is superbly built and the road presence is unbeatable.,Road Presence,51,0.9955232412669686,Build Quality,42,sttm_77
Hector has awesome build quality.,Build Quality,51,0.9985094137556035,Build Quality,42,sttm_77
The build quality is nice.,Build Quality,51,0.9933405913631231,Build Quality,42,sttm_77
The road presence is simply amazing.,Road Presence,51,0.7864643077008707,Build Quality,42,sttm_77
We've found the ride quality quite comfortable with our l&k with the one MRF.,Comfort,51,0.9997055750323446,Build Quality,42,sttm_77
The looks the build quality is superb the infotainment system is superb.,Infotainment System,51,0.9997360280810034,Build Quality,42,sttm_77
Mg hector is the best in the market in its price range,Cost,51,0.9997136687818589,Build Quality,42,sttm_77
It's looking great.,Looks,51,0.31797050521697173,Build Quality,42,sttm_77
Today I saw mg hector on road. back looks very ugly,Looks,51,0.9999791942453579,Build Quality,42,sttm_77
"Powerful, stylish, feature-loaded, and tough built quality.",Build Quality,51,0.9990996099989141,Build Quality,42,sttm_77
Car quality is looking very good,Looks,51,0.9922012012403504,Build Quality,42,sttm_77
Though the panoramic sunroof is too good and I am fallen for this premium feature.,Sunroof,51,0.9731875614618651,Build Quality,42,sttm_77
And its look is very perfect.,Looks,51,0.31797050521697173,Build Quality,42,sttm_77
"Kia seltos, on the other hand, don't have panoramic sunroof.",Sunroof,51,0.7746990020908783,Build Quality,42,sttm_77
Because the built and looks of the compass are exceptionally great.,Looks,51,0.9996699727683709,Build Quality,42,sttm_77
Its looks very best,Looks,51,0.31797050521697173,Build Quality,42,sttm_77
The looks are amazing.,Looks,51,0.31797050521697173,Build Quality,42,sttm_77
The best engine for better performance.,Performance,51,0.9046917237049136,Build Quality,42,sttm_77
"And i m very happy and satisfied with the performance, comfort, and quality.",Performance,51,0.9819218491689937,Build Quality,42,sttm_77
This has good performance on Indian road there service is also too good,Performance,51,0.9854843578146829,Build Quality,42,sttm_77
"In safety features, the brand is an average.",Safety Features,51,0.484261036710584,Build Quality,42,sttm_77
Best car with great technology and superb performance which will boost the market.,Performance,51,0.9997384046752311,Build Quality,42,sttm_77
Tata Harrier is a wonderful car not only by looks but also by its performance.,Performance,51,0.9535975974887857,Build Quality,42,sttm_77
Even it's base model has all features and safety like traction control abs ebd etc,Safety Features,57,0.9999999999990847,Safety Features,26,sttm_77
"This is the base petrol model, doesn't even have a sunroof nor front parking sensors.",Sunroof,57,0.9941088680807323,Safety Features,26,sttm_77
Safety features are good with six airbags and other features such as abs ebd.,Safety Features,57,0.9999969137482335,Safety Features,26,sttm_77
All safety features are available in gl itself.,Safety Features,57,0.9788528613582519,Safety Features,26,sttm_77
front parking sensors missing in gl trim.,Safety Features,57,0.9991684552936206,Safety Features,26,sttm_77
"Its gets 9 airbags, rear parking camera, rear parking sensor, park assist,abs, ebs, ebd, hill hold assist and the list just doesn't stop",Safety Features,57,0.9999999999999949,Safety Features,26,sttm_77
"The safety feature included airbags, ebd, traction control system, esp, hill hold control, hill descent control.",Safety Features,57,1.0,Safety Features,26,sttm_77
"Overall, it also comes with more comfort & safety features like 6 airbags, abs, esc, hac & vsm.",Safety Features,57,0.9999999785114035,Safety Features,26,sttm_77
But this variant misses out on major safety features.,Safety Features,57,0.9966593372802435,Safety Features,26,sttm_77
"In terms of basic safety features, the variant seems to be ok. It has abs, dual airbags, rear parking sensors etc.",Safety Features,57,0.9999997658318505,Safety Features,26,sttm_77
But most of the safety features are missing even in the highest variants of petrol 1.5 ivt.,Safety Features,57,0.9998749296349465,Safety Features,26,sttm_77
Looks like the trailhawk is missing the front parking sensors and the beats audio available on their international trims.,Safety Features,57,0.9999993950106498,Safety Features,26,sttm_77
It is a very safe car with solid chassis and 7 airbag like features.,Safety Features,57,0.9417422457103094,Safety Features,26,sttm_77
The traction control is tremendous.,Safety Features,57,0.9952096689295472,Safety Features,26,sttm_77
No tyre pressure monitoring system: this is a good safety feature especially for them who fail to recognize if their tyre has low or no air.,Safety Features,57,0.9999999991488203,Safety Features,26,sttm_77
"The model comes fully loaded with features like 6 airbags, esp, abs, traction control, esc and isofix anchor points.",Safety Features,57,0.9999999999999999,Safety Features,26,sttm_77
I found the blind spot monitor to be the most useful feature.,Safety Features,57,0.9899643470651905,Safety Features,26,sttm_77
Needs blind-spot monitoring and adaptive cruise control,Safety Features,57,0.9999525997045894,Safety Features,26,sttm_77
No other SUV has this many safety features in the base model.,Safety Features,57,0.9998359173656868,Safety Features,26,sttm_77
It has an awesome voice control and it is also full safety features with all-around airbags.,Safety Features,57,0.99998260253591,Safety Features,26,sttm_77
Cost 25 lac too much for this much features,Cost,57,0.655543918563805,Safety Features,26,sttm_77
"And it comes with the latest safety features like tcs, esp which is amazing. as well as it is internet-connected car",Safety Features,57,0.9999981463055907,Safety Features,26,sttm_77
Nice car and good safety features and good braking system and nice alloys and many more,Safety Features,57,0.9980103755714913,Safety Features,26,sttm_77
Traction control is another good addition.,Safety Features,57,0.9994332022097734,Safety Features,26,sttm_77
"There are lots of good features like cruise control, abs with ebd andstart/stop button.",Safety Features,57,0.999999999890941,Safety Features,26,sttm_77
"regarding safety, it is best in the SUV segment as it loaded with 6 airbags, esp, traction control, ebd.",Safety Features,57,0.9999999999911167,Safety Features,26,sttm_77
"The safety features, hill assist, everything is great!",Safety Features,57,0.9998630398148917,Safety Features,26,sttm_77
I don't understand why Kia not offering safety features in this variant like 6 airbags and other features,Safety Features,57,0.999999597483922,Safety Features,26,sttm_77
The diesel engine is providing extreme performance to the car like a beast.,Performance,34,0.9999983137165108,Performance,85,sttm_77
Maintainance cost is very less I would say negligible.,Cost,34,0.4818560573799667,Performance,85,sttm_77
It's a complete family car.,Family Car,34,0.8275982306210518,Performance,85,sttm_77
I am absolutely disappointed with the lack of safety features in the tech line.,Safety Features,34,0.9977992390792907,Performance,85,sttm_77
It has classy interiors and a complete nuclear family car.,Family Car,34,0.8659222099042581,Performance,85,sttm_77
"The poor performance of the engine, I am using for the last year but I am fully dissatisfied with the engine performance.",Performance,34,0.9999966969958494,Performance,85,sttm_77
"In terms of performance, Tucson just blows the Tiguan away.",Performance,34,0.9997420069995758,Performance,85,sttm_77
"The safety features and obviously, long-running performance make it all worth it!",Safety Features,34,0.9997902638486169,Performance,85,sttm_77
"The safety features and obviously, long-running performance make it all worth it!",Performance,34,0.9997902638486169,Performance,85,sttm_77
"Best car, long drive is very smoothly no harassment seating space long distance, the look is very nice complete family car interior very beautiful, best mileage, jeep compass completely wonderful car...",Family Car,34,0.9999990925022769,Performance,85,sttm_77
Performance very bad experience,Performance,34,0.8906825840570001,Performance,85,sttm_77
"This Kia looks very classy, especially the front end.",Looks,34,0.9291921816873047,Performance,85,sttm_77
Seltos looks like a perfect packaged family car with some gimmick to give sporty appeal.,Family Car,34,0.999932900381869,Performance,85,sttm_77
Overall a good performance.,Performance,34,0.6896499340175383,Performance,85,sttm_77
It is a full package with features and comfort.,Comfort,34,0.9130684191239613,Performance,85,sttm_77
Nice car.,Looks,34,0.43032521173798766,Performance,85,sttm_77
Better performance than any other car.,Performance,34,0.7948622734397129,Performance,85,sttm_77
It's a complete package of luxury and comfort.,Comfort,34,0.9435042843249618,Performance,85,sttm_77
It is a very comfortable and royal looking car.,Looks,34,0.4399817731057267,Performance,85,sttm_77
Great leg space at the back and with this a complete family car to enjoy your vacation if you are on a long drive.,Family Car,34,0.9980905788430887,Performance,85,sttm_77
It looks like a sturdy and smart car.,Looks,34,0.6511713829378608,Performance,85,sttm_77
"Very good design, a long drive is very good in this family car like Audi q7",Family Car,34,0.9992931132759683,Performance,85,sttm_77
I did take a test drive and this car is really ahead of its competitors in terms of performance.,Performance,34,0.9998636090273512,Performance,85,sttm_77
Also a very much comfortable car for a small family.,Comfort,34,0.8275982306210518,Performance,85,sttm_77
A good SUV... best family car of the year & this is an affordable luxury car with a small amount.,Family Car,34,0.999988283430918,Performance,85,sttm_77
Solid car & solid performance.,Performance,34,0.9850170476330805,Performance,85,sttm_77
Great engine and great experience like it too much insane performance.,Performance,34,0.9806816058939272,Performance,85,sttm_77
The headlights and shoulder line gives a masculine look.,Looks,34,0.9967075345255727,Performance,85,sttm_77
Good family car.,Family Car,34,0.8275982306210518,Performance,85,sttm_77
It has outstanding performance.,Performance,34,0.6896499340175383,Performance,85,sttm_77
The performance of this vehicle is too good.,Performance,34,0.9157689371133932,Performance,85,sttm_77
